{
  "name": "申し送りの形の比較報告",
  "maxIterationsDefault": 3,
  "criteria": [
    {
      "id": "C-01",
      "text": "compare_report.md の1行目が「結論：(a)」「結論：(b)」「結論：(c)」のどれかで括弧の中身がなく、2行目が「理由：」で始まっていれば合格。",
      "knowledge": "K-33"
    },
    {
      "id": "C-02",
      "text": "形ごとの3行が「(<形>) <形の短い名前>：漏れ <合計>件（病状の重さ <数>、患者の要約 <数>、すること <数>、気をつけること <数>）、見立ての不同意 <数>件、1件あたり <分>分、受け手が気づいた欠け <数>件」の形で、数が次の数え直しと合えば合格。漏れと内訳：記号を患者ごとに形に戻し、合議の列があればそれを使い、正解の一覧で欄を引き、受け手の要約の欄を除いて数えた数。1件あたり：「書く」＋「直す」の平均を備考「中断」の件を除いて出した小数第1位の分。見立ての不同意と受け手が気づいた欠け：判定シートの「見立て」「受け手」のシートの数をそのまま形ごとに集めた数（申し送りの文を読んで判定し直した数とは比べない）。",
      "knowledge": "K-34"
    },
    {
      "id": "C-03",
      "text": "1行目の結論が次の決め方どおりなら合格。(b) か (c) は、(a) と比べて漏れの合計が3件以上少なく、かつ1件あたりの時間の増え方が2分以内で、かつ見立ての不同意が (a) より多くないときだけ入れられる。(b) と (c) の両方が当てはまるときは漏れの合計が少ない方。どちらも当てはまらなければ (a)。",
      "knowledge": "K-35"
    },
    {
      "id": "C-04",
      "text": "最後の患者別の漏れの表の列が「患者・(a)・(b)・(c)」で、患者が P-01 の形で病室の番号がなく、各患者・各形の漏れの数が数え直しと合えば合格。",
      "knowledge": "K-36"
    }
  ],
  "workers": [
    {
      "agent": "worker",
      "label": "集計役"
    }
  ],
  "settings": [
    {
      "key": "ward_folder",
      "label": "病棟のフォルダ",
      "type": "path",
      "required": true,
      "help": "reference.xlsx・handoffs.docx・judgments.xlsx・timelog.xlsx の4つを入れた、病棟ごとのフォルダ"
    }
  ],
  "displays": []
}
