{
  "name": "売上CSVから部長向け週報を作る",
  "maxIterationsDefault": 3,
  "criteria": [
    {
      "id": "C-01",
      "text": "週報の担当ごとの金額が、sales.csv のその担当の円を万円にして1万円未満を切り捨てた数になっていれば合格（例：187,000円→18万円。19万円なら不合格）。",
      "knowledge": "K-23"
    },
    {
      "id": "C-02",
      "text": "1万円に満たない担当が「0万円」ではなく「1万円未満」と書いてあれば合格。",
      "knowledge": "K-24"
    },
    {
      "id": "C-03",
      "text": "週報の合計が、sales.csv の金額を円のまますべて足してから万円に切り捨てた数になっていれば合格（例：505,000円→50万円。49万円なら不合格）。",
      "knowledge": "K-25"
    },
    {
      "id": "C-04",
      "text": "週報の見出しが「■今週の売上」「■来週の予定」の2つだけでこの順に並び、最後の行が「以上」の2文字だけなら合格。",
      "knowledge": "K-26"
    },
    {
      "id": "C-05",
      "text": "成果物が Markdown のファイル weekly_report.md になっていれば合格。",
      "knowledge": "K-27"
    }
  ],
  "workers": [
    {
      "agent": "worker",
      "label": "週報づくり役"
    }
  ],
  "settings": [],
  "displays": []
}
