{
  "name": "最初に台へ戻す NG の選定",
  "maxIterationsDefault": 3,
  "criteria": [
    {
      "id": "C-01",
      "text": "pick.md の1行目「最初に台へ戻す：」の項目ID が、手順（保留を除く → 機能名をまとめる → NG がいちばん多い機能 → 前提条件を「、」で数えていちばん少ない項目）で選んだ項目と同じなら合格、違えば不合格。",
      "knowledge": "K-19"
    },
    {
      "id": "C-02",
      "text": "pick.md の機能ごとの NG の件数が、試験結果と試験仕様書から数え直した数（保留を数えず、「UART 受信」と「UART受信処理」のような書き方の違いをまとめた数）とすべて同じなら合格、1つでも違えば不合格。",
      "knowledge": "K-20"
    },
    {
      "id": "C-03",
      "text": "NG の件数がいちばん多い機能が2つ並んだとき、pick.md の理由が2行で、並んだ両方の機能と、どちらにしたかが書かれていれば合格。理由が1行しかない、または両方の機能か選んだ機能が書かれていなければ不合格。",
      "knowledge": "K-21"
    },
    {
      "id": "C-04",
      "text": "pick.md の1行目が「最初に台へ戻す：<項目ID>」の形で、「作成：」の行がなければ合格。どちらかに外れれば不合格。",
      "knowledge": "K-22"
    }
  ],
  "workers": [
    {
      "agent": "worker",
      "label": "NG 選定役"
    }
  ],
  "settings": [],
  "displays": []
}
